{
  "schemaVersion": 1,
  "algorithm": "parking-draw-chacha20-v2",
  "nonce": "000000000000000000000000",
  "initialCounter": 0,
  "uint32Endian": "big",
  "poolRemoval": "stable",
  "status": "completed",
  "reason": null,
  "streamHex": "ae56a439e258b5c7f954f0831cf775eb66f02906d1bc01091d20d96a",
  "pools": [
    {
      "id": "motorcycle_a",
      "status": "completed",
      "reason": null,
      "assignments": [
        {
          "household": "TEST-A-002",
          "spaceId": "87"
        },
        {
          "household": "TEST-A-003",
          "spaceId": "88"
        },
        {
          "household": "TEST-A-001",
          "spaceId": "86"
        }
      ],
      "waitlist": [],
      "unassignedHouseholds": [],
      "remainingSpaces": []
    },
    {
      "id": "motorcycle_b",
      "status": "completed",
      "reason": null,
      "assignments": [
        {
          "household": "TEST-B-002",
          "spaceId": "3"
        },
        {
          "household": "TEST-B-001",
          "spaceId": "2"
        }
      ],
      "waitlist": [],
      "unassignedHouseholds": [],
      "remainingSpaces": [
        "2-1",
        "3-1"
      ]
    },
    {
      "id": "bicycle_large",
      "status": "completed",
      "reason": null,
      "assignments": [
        {
          "household": "TEST-A-001",
          "spaceId": "大1"
        }
      ],
      "waitlist": [],
      "unassignedHouseholds": [],
      "remainingSpaces": []
    },
    {
      "id": "bicycle_small",
      "status": "skipped",
      "reason": "no_participants",
      "assignments": [],
      "waitlist": [],
      "unassignedHouseholds": [],
      "remainingSpaces": [
        "小39"
      ]
    }
  ]
}
