{
  "schemaVersion": 1,
  "algorithm": "parking-draw-chacha20-v2",
  "nonce": "000000000000000000000000",
  "initialCounter": 0,
  "uint32Endian": "big",
  "poolRemoval": "stable",
  "status": "completed",
  "reason": null,
  "streamHex": "ae56a439e258b5c7f954f0831cf775eb66f02906d1bc01091d20d96adaaafba5e5396c359183efd2",
  "pools": [
    {
      "id": "motorcycle",
      "status": "completed",
      "reason": null,
      "assignments": [
        {
          "household": "999-4",
          "spaceId": "64"
        },
        {
          "household": "997-2",
          "spaceId": "68"
        },
        {
          "household": "999-2",
          "spaceId": "82"
        },
        {
          "household": "997-3",
          "spaceId": "149"
        }
      ],
      "waitlist": [],
      "unassignedHouseholds": [],
      "remainingSpaces": [
        "1",
        "2",
        "2-1",
        "3",
        "3-1",
        "4",
        "5",
        "6",
        "7",
        "9",
        "10",
        "11",
        "12",
        "13",
        "14",
        "14-1",
        "15",
        "16",
        "17",
        "18",
        "19",
        "20",
        "21",
        "22",
        "23",
        "24",
        "25",
        "26",
        "27",
        "28",
        "29",
        "30",
        "31",
        "32",
        "33",
        "34",
        "35",
        "36",
        "37",
        "38",
        "39",
        "40",
        "41",
        "42",
        "43",
        "44",
        "45",
        "46",
        "47",
        "48",
        "49",
        "50",
        "51",
        "52",
        "53",
        "54",
        "55",
        "56",
        "57",
        "58",
        "59",
        "60",
        "61",
        "62",
        "65",
        "66",
        "67",
        "69",
        "70",
        "71",
        "72",
        "73",
        "74",
        "75",
        "76",
        "77",
        "78",
        "79",
        "80",
        "81",
        "83",
        "84",
        "85",
        "86",
        "87",
        "88",
        "90",
        "91",
        "92",
        "93",
        "94",
        "95",
        "96",
        "97",
        "98",
        "99",
        "100",
        "101",
        "102",
        "103",
        "104",
        "105",
        "106",
        "107",
        "108",
        "109",
        "110",
        "111",
        "112",
        "113",
        "114",
        "115",
        "116",
        "117",
        "118",
        "119",
        "120",
        "121",
        "122",
        "123",
        "124",
        "125",
        "126",
        "128",
        "129",
        "130",
        "131",
        "132",
        "133",
        "134",
        "135",
        "136",
        "137",
        "138",
        "139",
        "140",
        "141",
        "142",
        "143",
        "144",
        "145",
        "146",
        "147",
        "148",
        "150"
      ]
    },
    {
      "id": "bicycle_large",
      "status": "completed",
      "reason": null,
      "assignments": [
        {
          "household": "999-2",
          "spaceId": "大15"
        },
        {
          "household": "997-2",
          "spaceId": "大16"
        }
      ],
      "waitlist": [],
      "unassignedHouseholds": [],
      "remainingSpaces": [
        "大1",
        "大2",
        "大3",
        "大4",
        "大5",
        "大6",
        "大7",
        "大8",
        "大9",
        "大10",
        "大11",
        "大12",
        "大13",
        "大14",
        "大17",
        "大18",
        "大19",
        "大20",
        "大21",
        "大22",
        "大23",
        "大24",
        "大25",
        "大26",
        "大27",
        "大28",
        "大29",
        "大30",
        "大31",
        "大32",
        "大34",
        "大35",
        "大36",
        "大37",
        "大38"
      ]
    },
    {
      "id": "bicycle_small",
      "status": "skipped",
      "reason": "no_participants",
      "assignments": [],
      "waitlist": [],
      "unassignedHouseholds": [],
      "remainingSpaces": [
        "小39",
        "小40",
        "小41",
        "小42",
        "小43",
        "小44",
        "小45",
        "小46",
        "小47",
        "小48",
        "小49",
        "小50",
        "小51",
        "小52",
        "小53",
        "小54",
        "小55",
        "小56",
        "小57"
      ]
    }
  ]
}
