{
  "schemaVersion": 1,
  "algorithm": "parking-draw-chacha20-v2",
  "nonce": "000000000000000000000000",
  "initialCounter": 0,
  "uint32Endian": "big",
  "poolRemoval": "stable",
  "status": "completed",
  "reason": null,
  "streamHex": "ae56a439",
  "pools": [
    {
      "id": "motorcycle_a",
      "status": "skipped",
      "reason": "no_participants_and_no_candidates",
      "assignments": [],
      "waitlist": [],
      "unassignedHouseholds": [],
      "remainingSpaces": []
    },
    {
      "id": "motorcycle_b",
      "status": "skipped",
      "reason": "no_participants_and_no_candidates",
      "assignments": [],
      "waitlist": [],
      "unassignedHouseholds": [],
      "remainingSpaces": []
    },
    {
      "id": "bicycle_large",
      "status": "completed",
      "reason": null,
      "assignments": [
        {
          "household": "TEST-B-001",
          "spaceId": "大1"
        }
      ],
      "waitlist": [],
      "unassignedHouseholds": [
        "TEST-A-001"
      ],
      "remainingSpaces": []
    },
    {
      "id": "bicycle_small",
      "status": "skipped",
      "reason": "no_participants_and_no_candidates",
      "assignments": [],
      "waitlist": [],
      "unassignedHouseholds": [],
      "remainingSpaces": []
    }
  ]
}
